url,label_it,level,id.@language,id.@value
https://w3id.org/italia/social-security/controlled-vocabulary/CUStatement/prestazioni_in_forma_di_capitale_maturate_erogate_da_forme_pensionistiche_successive/A,"in caso di erogazione definiva (compreso le tipologie di riscatto previste dal D.Lgs. 252 del 5 dicembre 2005, laddove la causa del riscatto sia riconducibile al pensionamento dell’iscritto o alla cessazione del rapporto di lavoro per mobilità o altre cause non riconducibili alla volontà delle parti);",,it,A
https://w3id.org/italia/social-security/controlled-vocabulary/CUStatement/prestazioni_in_forma_di_capitale_maturate_erogate_da_forme_pensionistiche_successive/B,in caso di erogazione definitiva superiore ad un terzo della prestazione complessivamente maturata dal 1/1/2001 relativamente ai “vecchi iscritti a vecchi fondi” che non hanno optato per il regime tributario al 1/01/2007;,,it,B
https://w3id.org/italia/social-security/controlled-vocabulary/CUStatement/prestazioni_in_forma_di_capitale_maturate_erogate_da_forme_pensionistiche_successive/C,in caso di anticipazione;,,it,C
https://w3id.org/italia/social-security/controlled-vocabulary/CUStatement/prestazioni_in_forma_di_capitale_maturate_erogate_da_forme_pensionistiche_successive/I,in caso di prestazioni integrative a “vecchi iscritti a vecchi fondi” erogate da aziende di credito in crisi (Circ. n. 78/2001). In tal caso la prestazione integrativa maturata dall’1/1/2001 sarà assoggettata al regime tributario vigente al 31/12/2000 con conseguente applicazione dell’aliquota del TFR;,,it,I
https://w3id.org/italia/social-security/controlled-vocabulary/CUStatement/prestazioni_in_forma_di_capitale_maturate_erogate_da_forme_pensionistiche_successive/M,"in caso di capitalizzazione di pensioni erogate a “vecchi iscritti a vecchi fondi”, non connesse alla cessazione del rapporto di lavoro (Ris. n. 30/2002). In tal caso sulla prestazione maturata anteriormente al 2001 non si applica l’aliquota del TFR.",,it,M
